{
  "schema": "qorcap-readers/v0",
  "qorcap_version": "0.3.32",
  "readers": [
    {
      "id": "ppocrv6_small_rec_scorebug_spike",
      "version": "0.1-spike",
      "files": [
        {
          "kind": "code",
          "path": "eval/ocr_spike/roi.py",
          "sha256": "ae629bc30e39624cb6fe33b8e4eb2ef50948ab847dfd7e3bd694a01a76ac45ac"
        },
        {
          "kind": "code",
          "path": "eval/ocr_spike/preprocess.py",
          "sha256": "39e6e884ca2849ae37b865732726007710d11eddc23094366484d32b679d9c0f"
        },
        {
          "kind": "code",
          "path": "eval/ocr_spike/decode.py",
          "sha256": "b71b6907bdb74f6d6a503d9e980f959469df9f9690ddc44ad02b4b1de494d1d3"
        },
        {
          "kind": "code",
          "path": "eval/ocr_spike/ortrun.py",
          "sha256": "7f5e51efefcbbfb4b77aa877a68da5b5c9ad62085d1e47c8da47e104618e1bca"
        },
        {
          "kind": "code",
          "path": "eval/ocr_spike/ort_session.json",
          "sha256": "e085ac0713b86a2b0aff72d9d4536ca43f4bc1bf8987ca999628f0aa4276169f"
        },
        {
          "kind": "code",
          "path": "eval/ocr_spike/scorebug_dict.txt",
          "sha256": "aabbe6eea68a0bcc1b159d6031835b8fa83aaf6adeef35b23c317ff1483f537e"
        },
        {
          "kind": "pack",
          "path": "models/scorebug_rec_int8.onnx",
          "sha256": "09f13fce44628f43c29bf4af8c9f20564ae0ceedfa86743401bbc04d7cfa9777"
        }
      ]
    }
  ],
  "runtimes": [
    {
      "id": "onnxruntime",
      "version": "1.31.0",
      "sha256": "c8f3c0f7b51e0d12563f77829fc2632daade3a7d09b3a17b6cf3a50d490f5b0b"
    }
  ]
}
